Producto,Color,Formato,Uso,Espesor,Espesor de boquilla,Recomendaciones de boquilla,Adhesivo,Response
Tonalá,Café ZTO7,37x37 cm,Piso,7.6 mm,4 mm,Tabaco,Cerámico,"Tonalá de Daltile es el piso perfecto para cualquier espacio. Su tono café ZTO7 de 37x37 cm de tamaño, añade un toque moderno a la decoración. Su espesor de 7.6 mm lo hace resistente a los años y su calidad superior asegura que tu piso se mantenga hermoso por mucho tiempo. Tonalá de Daltile es la mejor opción para aquellos que buscan un piso de calidad que se mantenga hermoso. Es resistente, moderno y de fácil mantenimiento, lo que lo convierte en la mejor opción para tu hogar."
Park Avenue,Blanco PK01,45x45 cm.,Piso/Muro,7.5 mm,4 mm,Blanco Antiguo,Daltile Cerámico 1.0 Gris ó 1.1 Blanco,"Park Avenue de Daltile es una hermosa opción para agregar un toque de elegancia a cualquier espacio. Esta colección de pisos/muros de 45x45 cm. viene en un blanco PK01 sofisticado y moderno, con un espesor de 7.5 mm. Esta combinación de color y grosor le da a estos pisos/muros una resistencia duradera y una sensación de lujo. Una vez instalado, Park Avenue de Daltile se convertirá en el punto focal de cualquier habitación. Su estilo moderno y su color blanco puro harán que cualquier espacio se sienta renovado. Park Avenue de Daltile es una hermosa opción para todos aquellos que desean agregar un toque de elegancia a sus espacios."
Park Avenue,Negro PK05,45x45 cm.,Piso/Muro,7.5 mm,2 mm,Negro,Daltile Cerámico 1.0 Gris ó 1.1 Blanco,"Park Avenue de Daltile es una colección de baldosas de suelo/pared de color Negro PK05, con un tamaño de 45x45 cm. Estas baldosas son resistentes, con un espesor de 7.5 mm, lo que le da una sensación de durabilidad y estilo. Estas baldosas son perfectas para usar en pisos y muros, dando un toque moderno a cualquier espacio. La colección Park Avenue ofrece una variedad de colores y tamaños para elegir, para que puedas encontrar la combinación perfecta para tu hogar. Combinando estilo, durabilidad y resistencia, Park Avenue de Daltile es la mejor opción para tus proyectos de diseño interior."
Park Avenue,Blanco PK01,30x45 cm.,Muro,8.4 mm,2 mm,Blanco Antiguo,Daltile Cerámico 1.0 Gris ó 1.1 Blanco,"Park Avenue de Daltile es una línea de azulejos de alto rendimiento para uso en muros. Está disponible en un formato de 30x45 cm. y su color blanco PK01 es ideal para crear un ambiente moderno y sofisticado. Estos azulejos tienen un espesor de 8.4 mm y son resistentes al desgaste y a los daños por el uso diario. Son fáciles de limpiar y mantener, lo que los hace perfectos para usar en cocinas, baños, salas de estar y cualquier otra habitación de la casa. Park Avenue de Daltile es la elección perfecta para una decoración moderna y duradera."
Talavera,Azul ZXY6,30x30 cm. (Malla),Muro,4 mm,2 mm.,Blanco Brillante,Piso sobre Piso,"La Talavera de Daltile es una losa de cerámica de 4 mm de espesor, de color Azul ZXY6, de 30x30 cm. (Malla). Esta losa es perfecta para ser usada en muros, ya que es resistente a la humedad, al desgaste y a los cambios de temperatura. Esta losa es ideal para usar en exteriores, ya que su resistencia a los rayos UV es muy alta. Esta losa es muy fácil de limpiar, ya que su superficie es lisa y no absorbe la suciedad. Además, su acabado es brillante y no se desgasta con el tiempo. Esta losa es perfecta para darle un toque moderno a tu hogar."
Tigerwood,Brown ZAL3,18x50 cm.,Piso/Muro,9 mm.,4 mm.,Mocha,Cerámico,Tigerwood de Daltile es una hermosa opción para tus pisos y muros. Esta línea de productos de la marca Daltile es una combinación única de color y textura. El color Brown ZAL3 es un tono cálido y profundo que seguramente añadirá un toque de lujo a tu hogar. Esta línea de productos está disponible en formatos de 18x50 cm. con un espesor de 9 mm. para que puedas elegir el que mejor se adapte a tus necesidades. Tigerwood de Daltile es una excelente opción para tus proyectos de decoración interior.
Coronado,Gris ZJM2,45x45 cm.,Piso,7.5 mm.,4mm.,Gris Natural,Daltile Cerámico 1.0 Gris ó 1.1 Blanco,"El Coronado de Daltile es una baldosa moderna y elegante. Está hecha con un color gris ZJM2 y viene en un formato de 45x45 cm. Esta baldosa es ideal para usar en pisos, ya que su espesor de 7.5 mm. le da resistencia y durabilidad. Esta baldosa es perfecta para darle un toque moderno y elegante a cualquier espacio. Su diseño moderno y su color neutro lo hacen perfecto para combinar con cualquier estilo de decoración. Es fácil de limpiar y mantener, lo que la hace ideal para usar en cualquier espacio."
Whisper oak,Cherry GWH1,15x66 cm.,Piso,10.3 mm,4 mm.,Chocolate,Cerámico,"Whisper Oak de Daltile es el piso perfecto para aquellos que buscan una apariencia elegante y moderna. Está hecho de madera de cerezo GWH1, con una medida de 15x66 cm y un espesor de 10.3 mm. Esta madera de cerezo ofrece una belleza única y una durabilidad superior. Sus tonos cálidos y su textura natural le dan a cualquier espacio un toque de elegancia. El diseño de Whisper Oak de Daltile es una combinación perfecta de estilo y funcionalidad. Es duradero, resistente al desgaste y fácil de limpiar. Esta madera de cerezo es una excelente opción para aquellos que buscan un piso resistente, con una apariencia moderna y elegante."
Whisper oak,Brown GWH2,15x66 cm.,Piso,10.3 mm,4 mm.,Chocolate,Cerámico,"Whisper Oak de Daltile es el piso perfecto para agregar un toque de elegancia a cualquier espacio. La tonalidad Brown GWH2 de este producto de 15x66 cm de espesor 10.3 mm seguramente le dará una apariencia única a cualquier habitación. Esta madera sólida con sus tonalidades marrones le aportará un toque de modernidad y sofisticación a su hogar. La superficie de Whisper Oak es resistente al desgaste y fácil de limpiar, lo que lo hace ideal para una amplia variedad de espacios. Esta madera de Daltile es una elección inteligente para aquellos que buscan un toque de lujo y elegancia a su hogar."
Whisper oak,Gray GWH3,15x66 cm.,Piso,10.3 mm,4 mm.,Gris Ligero,Cerámico,"El Whisper Oak de Daltile es una losa de piso moderna y elegante. Está hecha de una madera gris GWH3 de 15x66 cm. de espesor 10.3 mm para una apariencia duradera y resistente. Esta losa es perfecta para agregar un toque moderno a cualquier habitación. Está diseñado para agregar una textura suave y una sensación cálida a la habitación. La losa Whisper Oak es fácil de limpiar y mantener, haciéndola una excelente opción para su hogar. Su diseño único y su color gris le darán a su hogar un estilo moderno y elegante. Esta losa es una excelente opción para cualquier hogar con un estilo moderno y elegante."
Rivalta,Marfil ZRL1,30x60 cm. Rect.,Muro,8.8 mm,2 mm,Blanco Antiguo,Cerámico,"Rivalta de Daltile es la elección perfecta para aquellos que buscan una solución de muro duradera y de alta calidad. Está disponible en un color marfil ZRL1 y un formato de 30x60 cm. Rect. para una versatilidad óptima. Con un espesor de 8.8 mm, Rivalta es una opción duradera y resistente, ideal para aplicaciones de muro. Esta opción elegante y duradera seguramente mejorará el aspecto de cualquier habitación. Con su resistencia y durabilidad, Rivalta de Daltile es una elección perfecta para aplicaciones de muro."
Rivalta,Marfil ZRL1,60.5x60.5 cm,Piso,8.8 mm,4 mm,Blanco antiguo,Cerámico,"Rivalta de Daltile es una hermosa opción para su piso. Viene en un color marfil ZRL1, con un tamaño de 60.5x60.5 cm. Está hecho de materiales de primera calidad, con un espesor de 8.8 mm. Esta losa de piso es perfecta para cualquier tipo de diseño de interiores, ya que ofrece una estética moderna y una sensación cálida al tocar. Rivalta es resistente y duradero, lo que lo hace ideal para su hogar. Su diseño único lo hace ideal para cualquier proyecto de remodelación. Ofrece una apariencia elegante y una sensación de calidad sin igual."
Corintia,Light Gray GC91,60.5x60.5 cm.  | 60x60 cm. Rect.,Piso,8.8 mm,Rect. 2 mm | Sin Rect. 4 mm,Blanco Brillante,Daltile Cerámico 1.0 Gris ó 1.1 Blanco,"Corintia de Daltile es un piso de color Light Gray GC91 con un tamaño de 60.5x60.5cm. | 60x60 cm. Rect., que ofrece un espesor de 8.8 mm. Esta opción de piso ofrece una apariencia moderna y elegante para todos los proyectos de diseño interior. El diseño de Corintia es único y se destaca por su diseño de estilo contemporáneo. Esta línea de pisos es resistente y duradero, lo que lo hace ideal para uso comercial y residencial. Además, el material es fácil de limpiar y mantener. Esta opción de piso es perfecta para aquellos que buscan una apariencia moderna y estilizada, sin comprometer la durabilidad y la resistencia."
Corintia,Oxford GC92,60.5x60.5 cm.  | 60x60 cm. Rect.,Piso,8.8 mm,Rect. 2 mm | Sin Rect. 4 mm,Blanco Brillante,Daltile Cerámico 1.0 Gris ó 1.1 Blanco,"La marca Daltile presenta Corintia, un piso con un color Oxford GC92, el cual es ideal para agregar un toque de modernidad a cualquier espacio. Con un tamaño de 60.5x60.5 cm. | 60x60 cm. Rect., Corintia es una opción perfecta para aquellos que buscan un piso resistente y duradero. Esta opción cuenta con un espesor de 8.8 mm, lo que significa que es una alternativa duradera para su hogar. Corintia ofrece una sensación de lujo y elegancia, haciendo que su espacio se vea moderno y refinado. Esta opción es perfecta para aquellos que desean un piso duradero y que no se desgaste con el paso del tiempo."
Momentum,Light Gray GM61,90x90 cm Rectificado,Piso,10.3 mm,2 mm,Gris Acero,Daltile Cerámico 1.0 Gris ó 1.1 Blanco,"Momentum de Daltile es una colección de pisos modernos y minimalistas que ofrecen una variedad de estilos para satisfacer cualquier gusto. La colección Momentum presenta una gama de colores y texturas en un formato de 90x90 cm Rectificado, con un espesor de 10.3 mm. El color Light Gray GM61 de Momentum es un gris claro que se destaca entre los demás colores de la colección. Esta colección es ideal para cualquier espacio, ya sea un hogar, oficina o comercial, que busque una apariencia moderna y elegante. Momentum de Daltile ofrece una gran variedad de opciones para satisfacer cualquier estilo y necesidad."
Momentum,Light Gray GM62,60x120 cm. Rectificado,Piso,10.6 mm,2mm,gris acero,Adhesivo Cerámico 1.0 Gris ó 1.1 Blanco,"Momentum de Daltile es una línea de azulejos de piso de color Light Gray GM62 en formato 60x120 cm. Rectificado. Esta línea de azulejos cuenta con un espesor de 10.6 mm, lo que los hace muy resistentes al desgaste. Su diseño moderno y elegante es perfecto para usar en cualquier espacio, desde una sala de estar hasta una cocina. Los azulejos Momentum son fáciles de limpiar y mantener, lo que los hace ideales para usar en espacios de alto tráfico. Su estilo único y su resistencia al desgaste lo hacen una excelente opción para su hogar."
Lauria,Blanco ZLR1,80x160 cm Rectificado,Piso/ Muro,10 mm.,2 mm.,Blanco Brillante,Porcelánico,"Lauria de Daltile es una hermosa opción para tus pisos y muros. Está disponible en un color blanco zlr1 y viene en un formato de 80x160 cm rectificado, con un espesor de 10 mm. Esta hermosa opción de piso y muro es perfecta para cualquier proyecto de diseño, ya que le dará un toque moderno y elegante a cualquier espacio. Sus características únicas, como su color blanco zlr1 y su formato rectificado, le permitirán destacarse entre otros productos. Si estás buscando una opción de piso y muro que sea duradera y que se vea espectacular, Lauria de Daltile es la opción ideal para ti."
Oslo,White ZOO1,30x60 cm. Rect.,Muro,8.8 mm,2 mm,Blanco Antiguo,,"Oslo de Daltile es una solución perfecta para revestir tus paredes. Viene en formato de 30x60 cm. Rect., con un espesor de 8.8 mm, y un elegante color White ZOO1. Está diseñado para uso en muros y es ideal para crear un ambiente moderno y único. Esta colección ofrece una gama de colores y tamaños para que puedas elegir el que mejor se adapte a tu espacio. Oslo de Daltile es una opción de calidad y durabilidad para los amantes de la decoración interior."
Cotto,Rojo GCO1,45x45 cm.,Piso,7.5 mm.,4 mm.,Chocolate,Cerámico,Cotto de Daltile es una hermosa opción para los pisos. El color Rojo GCO1 es un tono vibrante y brillante que seguramente llamará la atención. Esta versión de 45x45 cm. es perfecta para añadir un toque moderno a cualquier espacio. El espesor de 7.5 mm. garantiza una larga durabilidad y resistencia a la abrasión. Cotto de Daltile es una opción estilizada y resistente para tu hogar.
Irina,Crema ZIR6,37x37 cm,Piso,7.6 mm,4 mm,Blanco Brillante,Daltile Cerámico 1.0 Gris ó 1.1 Blanco,"Introducing Irina, un piso de alto rendimiento de la marca Daltile. Está hecho de un material de alta calidad con un espesor de 7.6 mm. Viene en un color crema ZIR6 y en un formato de 37x37 cm, lo que lo hace perfecto para cualquier tamaño de habitación. Está diseñado para resistir el uso diario y es ideal para usar en áreas con tráfico moderado a alto. Irina es una excelente opción para aquellos que buscan un piso duradero y de aspecto moderno. Su diseño único y su color crema le dan un toque clásico a cualquier hogar."
Pietra di Vals,Light Gray ZPV5,59x118 cm. Rectificado,Piso/Muro,10.6 mm,2 mm,Blanco Antiguo,Porcelánico,"Pietra di Vals es una hermosa opción para uso en pisos y muros. Está hecho de una ligera tonalidad gris ZPV5, de 10.6 mm de espesor, y viene en formato rectificado de 59x118 cm. Esta maravillosa creación de Daltile es ideal para agregar un toque de sofisticación a tu espacio, sin sacrificar la durabilidad. La textura única de Pietra di Vals combina a la perfección con una variedad de estilos de decoración, desde moderno hasta tradicional. Esta piedra es una excelente opción para aquellos que buscan una piedra de calidad, con estilo y durabilidad."
Pietra di Vals,Dark Gray ZPV6,59x118 cm. Rectificado,Piso/Muro,10.6 mm,2 mm,Negro Opaco,Porcelánico,"Pietra di Vals de Daltile es una opción de piso/muro con una apariencia sofisticada. Está hecho de una piedra de color Dark Gray ZPV6 y viene en un formato rectificado de 59x118 cm. Su espesor de 10.6 mm le da una sensación de durabilidad y resistencia. Esta piedra moderna es perfecta para proyectos de diseño de interiores y exteriores, ya que puede resistir la intemperie y los cambios de temperatura. Esta piedra es ideal para añadir un toque de elegancia y belleza a cualquier espacio. Esta piedra de Daltile es una excelente opción para cualquier proyecto de remodelación, ya que le dará a tu espacio un toque único y especial."
Kent,Champagne ZZ64,60.5x60.5 cm.,Piso/Muro,8.8 mm.,4 mm.,Blanco Antiguo,Ceramico,"Kent de la marca Daltile es una opción ideal para usar en pisos y muros. Su color Champagne ZZ64 y formato 60.5x60.5 cm. lo hacen perfecto para añadir un toque de elegancia a cualquier espacio. Su espesor de 8.8 mm. lo hace resistente y duradero, ideal para usar en usos pesados. Kent es una opción moderna y versátil para agregar un toque de sofisticación a cualquier hogar. Su diseño único y su color Champagne ZZ64 combinan perfectamente para crear una atmósfera lujosa y acogedora. Es la opción ideal para aquellos que buscan un producto de calidad para sus proyectos de decoración."
Emblem,Beige EM01,20x90 cm. | 20x90 cm. Rect.,Piso,9.8 mm.,2 mm Rect | 4 mm No Rect,Sepia,Porcelánico,El Emblem de Daltile es una elección perfecta para su piso. Viene en un color beige EM01 que se destaca por su brillo y tonalidad. Está disponible en dos tamaños: 20x90 cm. y 20x90 cm. Rect. Su espesor de 9.8 mm. le aporta resistencia y durabilidad. Esta combinación de diseño y resistencia lo hace ideal para cualquier ambiente. Su belleza y resistencia lo convierten en una excelente opción para su hogar. La calidad y el diseño de Emblem de Daltile le aportarán un toque único a su hogar.
Emblem,Brown EM02,20x90 cm. | 20x90 cm. Rect.,Piso,9.8 mm.,2 mm Rect | 4 mm No Rect,Mocha,Porcelánico,"El Emblem Brown EM02 de Daltile es el piso perfecto para tu hogar. Con un tamaño de 20x90 cm. Rect., este piso ofrece un espesor de 9.8 mm. para una sensación de lujo y comodidad. Su color marrón oscuro se complementa con su textura lisa para darle un toque de elegancia a tu hogar. Esta combinación de color y textura hará que tu hogar se vea moderno y fresco. Además, el Emblem Brown EM02 es fácil de limpiar y mantener, lo que significa que tu hogar se verá como nuevo durante mucho tiempo. No pierdas la oportunidad de tener un piso de lujo en tu hogar con el Emblem Brown EM02 de Daltile."
Emblem,Grey EM03,20x90 cm. | 20x90 cm. Rect.,Piso/Muro,9.8 mm,2 mm Rect | 4 mm No Rect,Gris Acero,Porcelánico,"El Emblem de Daltile es una opción de revestimiento de piso/muro de excelente calidad. Viene en un color gris EM03, en formato 20x90 cm. rect., y con un espesor de 9.8 mm para una durabilidad y resistencia óptimas. Esta losa es perfecta para usar en áreas de alto tráfico, ya que su resistencia la hace ideal para usarse en baños, cocinas y salas. Su diseño moderno y minimalista le dará un toque de elegancia a cualquier espacio, sin importar el estilo de decoración. Su versatilidad permitirá que lo uses en cualquier parte de tu hogar, creando un ambiente único con un toque de modernidad. El Emblem de Daltile es una opción ideal para revestir tus pisos y muros."
Emblem,Beige EM01,18x50 cm.,Piso/Muro,9 mm.,2 mm Rect | 4 mm No Rect,Sepia,Daltile Cerámico 1.0 Gris ó 1.1 Blanco,"El Emblem de Daltile es el perfecto acabado para el piso o muro de tu hogar. Su color beige EM01 es un tono cálido y clásico que se adapta a cualquier decoración. Con un tamaño de 18x50 cm., este emblem es ideal para espacios pequeños, y con un espesor de 9 mm., es resistente y duradero. Agrega un toque de elegancia a tu hogar con este hermoso y práctico producto de Daltile."
Emblem,Brown EM02,18x50 cm.,Piso/Muro,9 mm.,2 mm Rect | 4 mm No Rect,Mocha,Porcelánico,"El Emblem de Daltile es una hermosa opción para su piso o muro. Está hecho de materiales de alta calidad y su espesor de 9 mm. le da una sensación de durabilidad y resistencia. El color Brown EM02 es un tono cálido y acogedor que seguramente agregará un toque de elegancia a cualquier habitación. Viene en un tamaño de 18x50 cm., lo que hace que sea fácil de instalar y adaptarse a la mayoría de los espacios. El Emblem de Daltile es una excelente opción para aquellos que buscan un producto de calidad y duradero para sus proyectos de remodelación."
Emblem,Grey EM03,18x50 cm.,Piso/Muro,9 mm.,2 mm Rect | 4 mm No Rect,Gris Acero,Daltile Cerámico 1.0 Gris ó 1.1 Blanco,"El Emblem de Daltile es una elegante solución para su hogar. Esta baldosa en formato 18x50 cm. viene en un gris EM03 que seguramente se adaptará a su estilo. Esta baldosa de 9 mm. de espesor es perfecta para el piso o el muro, y con su durabilidad, le asegurará que su inversión dure muchos años. El Emblem de Daltile es una opción ideal para su hogar, que le dará un toque moderno y elegante."
Quartzite,White GQZ1,45x90 cm.  | 45x90 cm. Rect.,Piso/Muro,10.3 mm.,2 mm Rect | 4 mm No Rect,Gris Ligero,Cerámico,"Quartzite White GQZ1 de Daltile es una opción única para tus proyectos de piso y muro. Está disponible en formato 45x90 cm. Rect., con un espesor de 10.3 mm. Esta piedra natural es resistente y duradera, con una apariencia blanca y brillante que le da a tu espacio una sensación de lujo. Sus características únicas de resistencia al desgaste y al calor la hacen ideal para uso en áreas de alto tráfico. Quartzite White GQZ1 de Daltile es la opción perfecta para una decoración moderna y elegante."
Quartzite,Gray GQZ2,45x90 cm.  | 45x90 cm. Rect.,Piso/Muro,10.3 mm,2 mm Rect | 4 mm No Rect,Gris Acero,Cerámico,"Quartzite Gray GQZ2 de Daltile es un producto de gran calidad para uso en piso y muro. Con un tamaño de 45x90 cm. Rect., este material es ideal para proyectos de construcción y remodelación. Su espesor de 10.3 mm proporciona resistencia y durabilidad, haciendo de Quartzite una excelente opción para cualquier proyecto. El tono gris de Quartzite le da un toque moderno a cualquier espacio, haciendo de él una opción atractiva para los amantes de la decoración. Esta opción de Daltile ofrece una larga vida útil y una apariencia profesional. ¡Quartzite Gray GQZ2 es la elección perfecta para su proyecto!"
Quartzite,Multicolor GQZ3,45x90 cm.  | 45x90 cm. Rect.,Piso/Muro,10.3 mm,2 mm Rect | 4 mm No Rect,Gris Natural,Cerámico,"Quartzite Multicolor GQZ3 de Daltile es una hermosa opción para tus pisos y muros. Esta losa viene en un formato de 45x90 cm. Rect. y 10.3 mm de espesor, lo que la hace perfecta para proyectos de gran escala. Su color multicolor GQZ3 la hace única y versátil para cualquier estilo de decoración. Esta losa de Quartzite es ideal para uso interior y es una opción duradera y resistente para tus proyectos. Los detalles de su acabado brillante y su color único harán que tus espacios sean aún más hermosos. Así que, si buscas una losa de Quartzite de calidad y duradera, entonces la Multicolor GQZ3 de Daltile es la mejor opción."
Strongwood,Gray GSG1,20x120 cm. Rect.,Piso,10.3 mm,2 mm.,Sepia,Cerámico,"Strongwood de Daltile es un piso moderno y elegante de color Gray GSG1. Viene en un formato de 20x120 cm. Rect. con un espesor de 10.3 mm. Esta innovadora combinación de materiales y estética ofrece una durabilidad y resistencia increíbles para su uso en su hogar. Strongwood es una opción perfecta para aquellos que buscan un piso moderno y resistente. Su color Gray GSG1 lo hace ideal para combinar con cualquier decoración, desde clásica hasta moderna. Sus dimensiones 20x120 cm. Rect. lo hacen perfecto para una variedad de espacios. Strongwood de Daltile es una excelente opción para aquellos que buscan un piso moderno y resistente para su hogar."
Strongwood,Dark Brown GSG3,20x120 cm. Rect.,Piso/Muro,10.3 mm,2 mm.,Tabaco,Cerámico,"Strongwood de Daltile es una opción ideal para todos los proyectos de piso y muro. Su color Dark Brown GSG3 se destaca entre la multitud, dando un toque de elegancia a cualquier espacio. Viene en un formato de 20x120 cm. Rect., con un espesor de 10.3 mm para una durabilidad excepcional. Esta hermosa opción de madera sintética es resistente a la humedad, por lo que es ideal para uso en áreas húmedas. Strongwood de Daltile es la opción perfecta para una decoración moderna y elegante."
Strongwood,Cherry GSG2,20x120 cm. Rect.,Piso/ Muro,10.3 mm,2 mm.,Chocolate,Cerámico,"Strongwood de Daltile es un producto de primera calidad. Con un color Cherry GSG2, este producto viene en un formato 20x120 cm. Rect. para uso en pisos y muros. Su espesor de 10.3 mm le da una durabilidad y resistencia únicas, lo que lo hace ideal para cualquier proyecto de construcción o remodelación. Además, está fabricado con materiales de la más alta calidad para garantizar la mejor experiencia al usuario. Strongwood es la opción perfecta para aquellos que buscan un producto de calidad, resistente y duradero."
Zen,Light Gray ZST2,60.5x60.5 cm.,Piso,9 mm.,4 mm.,Gris Acero,Daltile Cerámico 1.0 Gris ó 1.1 Blanco,"Zen de Daltile es una opción de piso moderna y elegante. Viene en un color gris claro ZST2 y su formato es de 60.5x60.5 cm. Su espesor de 9 mm. lo hace ideal para espacios grandes y pequeños, ofreciendo una apariencia refinada y duradera. El piso Zen de Daltile es una excelente opción para cualquier espacio, ya que aporta un toque moderno y elegante. Además, es fácil de instalar y mantener, lo que asegura que tu espacio se mantenga hermoso durante mucho tiempo."
Zen,Multicolor ZST1,60.5x60.5 cm.,Piso,9 mm.,4 mm.,Gris Acero,Daltile Cerámico 1.0 Gris ó 1.1 Blanco,"Zen de Daltile es una solución moderna para su piso. Esta belleza multicolor ZST1 se presenta en un formato de 60.5x60.5 cm. y es de 9 mm de espesor. Esta alfombra de vinilo es resistente al agua y no se desvanece con el tiempo. Es perfecta para su hogar, ya que es fácil de limpiar y mantiene su aspecto original. Esta alfombra de vinilo es la elección perfecta para su hogar gracias a su durabilidad, resistencia al desgaste y estilo moderno. Zen de Daltile le dará a su hogar el toque de estilo y elegancia que estaba buscando."
Zen,Gray ZST3,60.5x60.5 cm.,Piso,9 mm.,4 mm.,Gris Acero,Daltile Cerámico 1.0 Gris ó 1.1 Blanco,"Zen de Daltile es un piso moderno, con una tonalidad gris ZST3. Su formato de 60.5x60.5 cm. es perfecto para espacios pequeños. El espesor de 9 mm. lo hace resistente y duradero, dando un toque de elegancia a tus espacios. Esta marca se destaca por su calidad y durabilidad, lo que garantiza una excelente inversión. Zen de Daltile es la opción perfecta para darle vida y modernidad a tus espacios."
Vento,White GVN1,60x120 cm. Rect.,Piso/Muro,10.3 mm,2 mm,Gris Natural,Daltile Cerámico 1.0 Gris ó 1.1 Blanco,"Vento de Daltile es una cerámica de primera calidad. Su color blanco GVN1 lo hace ideal para cualquier ambiente. Viene en formato 60x120 cm. Rect., para uso de Piso/Muro, con un espesor de 10.3 mm. Esta cerámica es resistente a la humedad y a los golpes, lo que la hace perfecta para uso en cocinas, baños, patios y áreas exteriores. El diseño moderno de Vento de Daltile le da un toque de elegancia a cualquier espacio, con una durabilidad que lo hará durar por muchos años."
