Producto,Descripcion,Link,Categoria,Response
Fregadero BE 50.40 10125011,Fregadero con instalación de submontar de acero inoxidable con acabado pulido,https://www.llanodelatorre.com.mx/fregadero-be-5040-10125011/p,Fregadero,"El Fregadero BE 50.40 10125011 de Llano de la Torre es una excelente opción para añadir un toque moderno a cualquier cocina. Está hecho de acero inoxidable de alta calidad con un acabado pulido, lo que lo hace resistente y duradero. La instalación de Simplo lo hace fácil de instalar. El fregadero tiene un diseño ergonómico, lo que significa que es cómodo de usar y fácil de limpiar. El tamaño compacto de la unidad significa que se ajusta fácilmente a cualquier espacio de cocina. El fregadero BE 50.40 10125011 de Llano de la Torre es una excelente opción para aquellos que quieren un fregadero moderno, resistente y de fácil uso."
Fregadero BE 79.43 (TU 31.19) 10125114,"Su elegante diseño en acero inoxidable de primera calidad, brinda un elemento de elegancia",https://www.llanodelatorre.com.mx/fregadero-be-7943-tu-3119-10125114/p,Fregadero,"El Fregadero BE 79.43 (TU 31.19) 10125114 de Llano de la Torre es un producto de primera calidad. Su acabado en acero inoxidable le otorga un toque de elegancia a cualquier cocina. Está diseñado para ser de fácil instalación, gracias a la instalación de Simplo, que le permite ajustarse a cualquier tipo de encimera. Su diseño moderno y sus bordes redondeados lo hacen ideal para cualquier espacio. Además, su construcción robusta y resistente a la corrosión lo hacen duradero y fácil de limpiar. Este fregadero es una excelente opción para aquellos que buscan un producto de calidad y durabilidad."
Fregadero C-110 Acero Inoxidable,Nuestras Tarjas de la línea Clásica de empotrar son de fácil instalación y se pueden colocar en cualquier tipo de cubierta,https://www.llanodelatorre.com.mx/fregadero-c-110-acero-inoxidable/p,Fregadero,"El Fregadero C-110 de Acero Inoxidable de Llano de la Torre es una tarja de empotrar de fácil instalación y con la que podrás tener una cocina moderna y funcional. Esta tarja es perfecta para todo tipo de cubierta, ya que su instalación es de Simplo. Esta tarja de empotrar es resistente, duradera y de fácil mantenimiento. El diseño de este fregadero es moderno y elegante, ideal para aquellos que quieren darle un toque moderno a su cocina. El Fregadero C-110 de Acero Inoxidable de Llano de la Torre es la opción perfecta para aquellos que buscan un producto de calidad, resistente y con buen diseño."
Fregadero MC-101 Acero Inoxidable,Nuestras Tarjas de la línea Mark de empotrar son de fácil instalación y se pueden colocar en cualquier tipo de cubierta,https://www.llanodelatorre.com.mx/fregadero-mc-101-acero-inoxidable/p,Fregadero,El Fregadero MC-101 de Acero Inoxidable de la marca Llano de la Torre es una tarja de empotrar de fácil instalación. Está diseñado para ser colocado en cualquier tipo de cubierta y ofrece una instalación de Simplo. Su diseño moderno y resistente lo hace ideal para uso diario. El acero inoxidable le da una apariencia elegante y resistente a la corrosión y a los arañazos. El fregadero MC-101 es una excelente opción para aquellos que desean una tarja de empotrar de alta calidad. Su diseño ergonómico y su material de calidad le permiten trabajar cómodamente. Esta tarja de empotrar es una excelente opción para aquellos que buscan un producto duradero y resistente.
Monomando MF 2 Project 81.9113.62,Grifo de cocina monomando con caño bajo giratorio y aireador anti-calcáreo,https://www.llanodelatorre.com.mx/monomando-mf-2-project-81911362/p,Monomando cocina,"El Monomando MF 2 Project 81.9113.62 de Llano de la Torre es una llave monomando para cocina de alta calidad, diseñada para una instalación de Simplo. Esta llave cuenta con un caño bajo giratorio y un aireador anti-calcáreo, lo que hace que sea una excelente opción para los monomandos para cocina. Su diseño ergonómico permite un manejo fácil y cómodo, lo que la hace ideal para su uso en la llave para fregadero. Esta llave monomando cocina es una excelente opción para aquellos que buscan una solución de calidad para sus necesidades."
Monomando E-308 Cromo,"Monomando para fregadero Gourmet Twin profesional doble, cabezal con sistema anti calcáreo y 2 tipos de chorro",https://www.llanodelatorre.com.mx/monomando-e-308-cromo/p,Monomando cocina,"El Monomando E-308 Cromo de Llano de la Torre es una llave monomando para cocina ideal para instalación de Simplo. Esta llave para fregadero es perfecta para tu cocina Gourmet Twin profesional doble, ya que cuenta con un cabezal con sistema anti calcáreo y dos tipos de chorro. Esta llave monomando para cocina es perfecta para los monomandos de tu cocina, ya que es resistente y duradera. El Monomando E-308 Cromo de Llano de la Torre es una excelente opción para una instalación duradera y resistente."
Mezcladora ME-302 Cromo,Llave mezcladora para fregadero Tritón,https://www.llanodelatorre.com.mx/mezcladora-me-302-cromo/p,Mezcladora cocina,"La Mezcladora ME-302 Cromo de Llano de la Torre es una llave mezcladora para fregadero Tritón de alto rendimiento. Esta mezcladora para cocina es perfecta para una instalación de Simplo. Esta mezcladora se caracteriza por su estilo moderno con un acabado cromado, lo que la hace ideal para cualquier tipo de cocina. El diseño ergonómico de la llave mezcladora, la hace muy fácil de usar y ajustar. Esta mezcladora para cocina también cuenta con una válvula de retención para evitar que el agua salga con demasiada presión. Esta mezcladora es perfecta para aquellos que buscan una solución duradera para su fregadero."
Mezcladora 7594C Cromo,Monomando para tarja con acabado en cromo,https://www.llanodelatorre.com.mx/mezcladora-7594c-cromo/p,Mezcladora cocina,"La Mezcladora 7594C Cromo de Llano de la Torre es una mezcladora para cocina de alto rendimiento, con una llave mezcladora que ofrece un excelente control sobre el flujo de agua. Está diseñada con un acabado en cromo que le da un toque moderno y elegante a tu cocina. Esta mezcladora es especialmente fácil de instalar gracias a la tecnología de instalación de Simplo, que permite una instalación más rápida y segura. Esta mezcladora para cocina es resistente a la corrosión y seguridad, por lo que es una excelente opción para tu cocina. Es duradera, fácil de limpiar y ofrece una excelente relación calidad-precio."
"Fregadero Tke 3 Perforaciones 7"" 840.560 2C 08101130","Fregadero de acero inoxidable, de instalación de empotre",https://www.llanodelatorre.com.mx/fregadero-840560-2c-tke-3perf-7-08101130/p,Fregadero,"El Fregadero Tke 3 Perforaciones 7"" 840.560 2C 08101130 de Llano de la Torre es una excelente opción para los amantes de la cocina. Está hecho de acero inoxidable de primera calidad, lo que lo hace duradero y resistente a la corrosión. Su instalación de empotre le permite una fácil instalación, ahorrando tiempo y esfuerzo. Esta versión también posee una instalación de Simplo, para una mayor facilidad de uso. El fregadero cuenta con 3 perforaciones, lo que le da una mayor capacidad de almacenamiento para los utensilios de cocina. Está disponible en un color blanco brillante que se verá perfecto en cualquier estilo de cocina. Su diseño moderno y funcional es ideal para aquellos que buscan un fregadero con una excelente relación calidad-precio."
Monomando Elite E-300 Cromo,Llave monomando para fregadero Elite,https://www.llanodelatorre.com.mx/monomando-e-300-elite-cromo/p,Monomando cocina,"El Monomando Elite E-300 Cromo de Llano de la Torre es una llave monomando para fregadero de alta calidad para uso en cocinas. Esta llave monomando cocina ofrece una instalación de Simplo, la cual es una forma sencilla y rápida de instalar la llave con una sola mano. Esta llave monomando cocina es perfecta para proporcionar un control preciso de la temperatura y flujo de agua. Esta llave monomando para cocina está diseñada con un acabado cromado resistente a la corrosión, lo que la hace ideal para uso en el fregadero. Su diseño ergonómico y ligero hace que sea fácil de usar y ofrece una amplia variedad de configuraciones. El Monomando Elite E-300 Cromo de Llano de la Torre es la mejor opción para una instalación de calidad y duradera."
Mezcladora 9373INOX Acero Inoxidable,"Mezcladora de 8"" para fregadero, con cubierta y manerales de palanca",https://www.llanodelatorre.com.mx/mezcladora-9373inox-inox/p,Mezcladora cocina,"La Mezcladora 9373INOX de Acero Inoxidable de Llano de la Torre es una mezcladora para cocina de 8"" ideal para fregaderos. Está fabricada con materiales de alta calidad para garantizar una larga vida útil. Esta mezcladora para cocina incluye una cubierta y manerales de palanca para una fácil instalación. La llave mezcladora es de diseño ergonómico para una mayor comodidad y facilidad de uso. La instalación de la Mezcladora 9373INOX es muy sencilla gracias al sistema de instalación Simplo. Esta mezcladora para cocina es resistente al óxido y a la corrosión, lo que la hace ideal para uso en ambientes húmedos. Su diseño moderno y elegante es perfecto para cualquier cocina."
Fregadero C-102N Acero Inoxidable,Nuestras Tarjas de la línea Clásica de empotrar son de fácil instalación y se pueden colocar en cualquier tipo de cubierta,https://www.llanodelatorre.com.mx/fregadero-c-102n-acero-inoxidable/p,Fregadero,"El Fregadero C-102N de Acero Inoxidable de Llano de la Torre es una tarja de empotrar de fácil instalación. Está diseñada para ser colocada en cualquier tipo de cubierta. Su instalación es de Simplo, lo que significa que el proceso de instalación es más rápido y sencillo. Esta tarja se caracteriza por su resistencia y durabilidad, ya que está fabricada con materiales de alta calidad. Su diseño moderno y minimalista aporta un toque de elegancia a cualquier espacio. El Fregadero C-102N de Acero Inoxidable de Llano de la Torre es el producto ideal para aquellos que buscan una tarja de empotrar con una instalación sencilla y una estética moderna."
Fregadero BE 2C 845 10125048,Fregadero con instalación de submontar de acero inoxidable,https://www.llanodelatorre.com.mx/fregadero-be-2c-845-10125048/p,Fregadero,"El Fregadero BE 2C 845 10125048 de Llano de la Torre es una excelente opción para tu cocina. Está fabricado con acero inoxidable de alta calidad y cuenta con una instalación de Simplo para asegurar una fácil y segura instalación. Esta característica permite una instalación sencilla sin necesidad de herramientas adicionales. El fregadero es profundo y ofrece un amplio espacio de trabajo para lavar y cocinar. El acabado de acero inoxidable le da un toque moderno a tu cocina, además de ser resistente a la corrosión y los arañazos. El diseño ergonómico del fregadero BE 2C 845 10125048 ofrece una comodidad y una facilidad de uso excepcionales. El fregadero es perfecto para cualquier cocina, ya sea moderna o tradicional."
Medio Cespol para Fregadero 250,Céspol de latón para fregadero sin contra canasta con tuerca que permite hacer movimientos para su mejor instalación,https://www.llanodelatorre.com.mx/medio-cespol-250-pfreg/p,Cespol,"El Medio Cespol para Fregadero 250 de Llano de la Torre es una solución ideal para la instalación de un fregadero. Está fabricado con latón de alta calidad y cuenta con una tuerca para una mejor sujeción. El céspol sin contra canasta es ideal para una instalación de Simplo. Además, el kit incluye un sifón con un Tubo de Lavabo y un Tubo en forma de U para una fácil conexión. El Medio Cespol para Fregadero 250 de Llano de la Torre es una excelente opción para una instalación rápida y sencilla."
Mezcladora 4318 Cromo,"Mezcladora de 8"" para fregadero",https://www.llanodelatorre.com.mx/mezcladora-4318-cromo/p,Mezcladora cocina,"La Mezcladora 4318 Cromo de Llano de la Torre es una mezcladora para cocina de 8"" con una llave mezcladora moderna. Esta mezcladora cuenta con una instalación de Simplo fácil de usar, lo que le permite a los usuarios controlar la cantidad de agua que sale de la mezcladora. Esta mezcladora está hecha de acero cromado resistente y es ideal para usar en cocinas modernas. Esta mezcladora es fácil de instalar y es compatible con la mayoría de los fregaderos. Su diseño ergonómico y su llave mezcladora moderna le permiten a los usuarios controlar el flujo de agua de forma sencilla. Esta mezcladora es una excelente opción para aquellos que buscan una mezcladora de alta calidad para su cocina."
MEZCLADORA NIO S75005  CROMO,Monomando desplegable para cocina,https://www.llanodelatorre.com.mx/72-17-mezcladora-nio-s75005-cromo/p,Mezcladora cocina,"La MEZCLADORA NIO S75005 CROMO de Llano de la Torre es una llave mezcladora diseñada para mejorar la funcionalidad de tu cocina. Esta mezcladora para cocina cuenta con un monomando desplegable, que permite una instalación de Simplo y un control preciso de la temperatura y presión del agua. La mezcladora NIO S75005 CROMO es una pieza moderna y elegante, con un acabado cromado que le da un aspecto atractivo a cualquier cocina. La mezcladora NIO S75005 CROMO ofrece una excelente calidad y durabilidad, además de una operación silenciosa y suave. Esta mezcladora para cocina es una excelente opción para aquellos que buscan una mezcladora de calidad para su hogar."
Fregadero C-200 Acero Inoxidable,Nuestras Tarjas de la línea Clásica de empotrar son de fácil instalación y se pueden colocar en cualquier tipo de cubierta,https://www.llanodelatorre.com.mx/fregadero-c-200-acero-inoxidable/p,Fregadero,El Fregadero C-200 Acero Inoxidable de Llano de la Torre es una tarja de empotrar de fácil instalación. Está diseñada para ser colocada en cualquier tipo de cubierta. El acero inoxidable de alta calidad garantiza una larga durabilidad y resistencia a la corrosión. El diseño moderno y compacto de este fregadero le da un toque de elegancia a cualquier cocina. La instalación es un proceso de Simplo que no requiere de herramientas especiales o conocimientos técnicos. El Fregadero C-200 Acero Inoxidable es una excelente opción para aquellos que quieren un fregadero de calidad y durabilidad sin tener que pagar un precio exorbitante.
Tarja 18G SS 18SB.9232100S.075,Tarja para cocina Portsmouth,https://www.llanodelatorre.com.mx/18sb9232100s075-tarja-18g-ss/p,Fregadero,La Tarja 18G SS 18SB.9232100S.075 de Llano de la Torre es una tarja para fregadero de cocina Portsmouth perfecta para una instalación de Simplo. Esta tarja cuenta con una superficie de acero inoxidable de 18 guage y una construcción de acero sólido para una mayor resistencia y durabilidad. Su diseño moderno y elegante se adapta a cualquier estilo de cocina. El acabado brillante de la tarja ofrece una apariencia limpia y profesional. La tarja también incluye una válvula de drenaje para una instalación fácil y una función de sellado para evitar fugas. Esta tarja es una excelente opción para aquellos que buscan una tarja moderna y resistente para su cocina.
Monomando para Cocina 7565 Cromo,"Monomando extraíble para tarja con rociador, acabado en cromo",https://www.llanodelatorre.com.mx/monomando-7565-pcocina-cromo/p,Monomando cocina,"El Monomando para Cocina 7565 Cromo de Llano de la Torre es una excelente opción para la instalación de tu cocina. Esta llave monomando es especialmente diseñada para tarjas con rociador, y su acabado en cromo le da un toque moderno y elegante a tu cocina. Se trata de una llave para fregadero que se instala de forma simple y rápida, gracias a la instalación de Simplo. Esta llave monomando para cocina es fácil de usar y limpiar, y además es resistente a la corrosión y a los rayones. Su diseño moderno y su construcción de alta calidad harán de esta llave monomando una excelente opción para tu cocina."
Fregadero M-102 Acero Inoxidable,Nuestras Tarjas de la línea Mark de empotrar son de fácil instalación y se pueden colocar en cualquier tipo de cubierta,https://www.llanodelatorre.com.mx/fregadero-m-102-acero-inoxidable/p,Fregadero,"El Fregadero M-102 de Acero Inoxidable de Llano de la Torre es la mejor opción para aquellos que busquen una instalación de simplo. Esta tarja de empotrar está diseñada para ser fácil de instalar en cualquier tipo de cubierta. El acero inoxidable es resistente a la corrosión y los arañazos, lo que lo hace ideal para usar en el fregadero. El diseño moderno, con líneas limpias, se integra perfectamente en cualquier cocina. El fregadero M-102 de acero inoxidable de Llano de la Torre es práctico, duradero y fácil de limpiar. Esta tarja de empotrar es una excelente opción para aquellos que busquen una instalación sencilla y una tarja de empotrar de alta calidad."
Fregadero de Empotrar Mark M-110-22,Nuestras Tarjas de la línea Mark de empotrar son de fácil instalación y se pueden colocar en cualquier tipo de cubierta,https://www.llanodelatorre.com.mx/fregadero-m-110-22-mark-empotrar/p,Fregadero,"El Fregadero de Empotrar Mark M-110-22 de Llano de la Torre es la mejor opción para tu cocina. Esta tarja cuenta con una instalación de Simplo que la hace fácil de colocar en cualquier tipo de cubierta. Su diseño moderno le da un toque de estilo a tu cocina. Además, cuenta con una resistencia superior gracias a su material de acero inoxidable. Esta tarja también cuenta con una garantía de 10 años para que puedas disfrutar de ella durante mucho tiempo. Esta tarja es perfecta para aquellos que buscan una tarja elegante, resistente y duradera. Esta tarja es una excelente opción para aquellos que quieren tener un fregadero de empotrar de calidad."