Producto,Descripcion,Link,Categoria,Response
Tarja BE Línea R15 50.40 115000005 Acero Inoxidable,"Tarja de acero inoxidable con accesorios de fijación, incluye accesorios, Kit de instalación y rebosadero con tapa decorativa",https://www.llanodelatorre.com.mx/tarja-be-linea-r15-5040-115000005-acero-inox/p,Fregadero,"La Tarja BE Línea R15 50.40 115000005 Acero Inoxidable de Llano de la Torre es el producto ideal para cualquier fregadero. Esta tarja de acero inoxidable incluye accesorios de fijación, un Kit de instalación y un rebosadero con tapa decorativa. Esta tarja está diseñada para una instalación de Simplo, lo que la hace fácil de instalar y mantener. Esta tarja cuenta con un diseño moderno y elegante que se adapta a cualquier decoración. Esta tarja de acero inoxidable es una excelente opción para su hogar ya que es resistente a la corrosión y duradera. Esta tarja es una gran inversión para tu cocina."
Mezcladora 7633 Cromo,"Mezcladora de 8"" para fregadero, con cubierta y manerales de palanca",https://www.llanodelatorre.com.mx/mezcladora-7633-cromo/p,Mezcladora cocina,"La Mezcladora 7633 Cromo de Llano de la Torre es una mezcladora de 8"" para fregadero de alta calidad. Esta mezcladora para cocina está fabricada con una cubierta y manerales de palanca resistentes para una durabilidad óptima. La llave mezcladora es un accesorio práctico, y su instalación de Simplo es una característica que hace que su montaje sea un proceso rápido y sencillo. Esta mezcladora es una excelente opción para quienes buscan una mezcladora de alta calidad para su cocina. Su robusta construcción la hace ideal para el uso diario, y su diseño moderno se adapta a cualquier estilo de cocina. Esta mezcladora es la solución perfecta para quienes buscan una mezcladora resistente y duradera."
Paquete Duetto Plus Campana y Parrilla 60 00251,Pack dueto plus 60TMX 60 PLUS+EP 60 4G AI CI,https://www.llanodelatorre.com.mx/paquete-duetto-plus-60-00251-campanaparri/p,Otros,[]
Fregadero Bahía 1C Plus 12127001,Tu fregadero se convertirá en toda una obra de arte. Elegancia y funcionalidad marcan la diferencia,https://www.llanodelatorre.com.mx/fregadero-bahia-1c-plus-12127001/p,Fregadero,"El Fregadero Bahía 1C Plus 12127001 de Llano de la Torre es una obra de arte para tu cocina. Su diseño moderno se complementa con la instalación de Simplo para una instalación fácil y rápida. Su acabado en acero inoxidable resistente a la corrosión y a los arañazos le da un toque de elegancia a tu cocina. Esta exclusiva creación de Llano de la Torre es perfecta para aquellos que buscan un look moderno y funcional. El Fregadero Bahía 1C Plus 12127001 es resistente a la humedad, fácil de limpiar y con una capacidad de almacenamiento increíble. Esta es la opción perfecta para aquellos que buscan un fregadero duradero y de calidad."
Monomando 7864 Cromo,Monomando para tarja con acabado en cromo,https://www.llanodelatorre.com.mx/monomando-7864-cromo/p,Monomando cocina,"El Monomando 7864 Cromo de Llano de la Torre es la mejor opción para tus monomandos para cocina. Esta llave monomando cocina es una solución perfecta para tu fregadero, ya que su acabado en cromo se ve elegante y moderno. Está diseñado para una instalación de Simplo, lo que significa que es fácil de instalar. El Monomando 7864 Cromo de Llano de la Torre es resistente, duradero y de fácil limpieza. Esta llave monomando cocina viene con un diseño ergonómico que te permite controlar el flujo de agua con facilidad. Es una excelente opción para obtener una llave para fregadero de alta calidad, con un acabado moderno y elegante."
Monomando E-306 Cromo,"Llave monomando para fregadero Palma, con cabezal retráctil, sistema anti calcáreo y dos tipos de chorro",https://www.llanodelatorre.com.mx/monomando-e-306-cromo/p,Monomando cocina,"Monomando E-306 Cromo de Llano de la Torre es la mejor opción para tu cocina. Esta llave monomando para fregadero Palma es ideal para tu instalación de Simplo, ya que cuenta con cabezal retráctil, sistema anti calcáreo y dos tipos de chorro. Esta llave monomando para cocina es perfecta para tener un control total sobre el flujo de agua en tu cocina, ya que su diseño ergonómico y moderno te permite manejar los monomandos para cocina de forma sencilla. Esta llave para fregadero es la mejor opción para tener una cocina moderna y eficiente."
Monomando Project Cuello Alto MF 2 81.9114.62,"Monomando alto, acabado en cromo",https://www.llanodelatorre.com.mx/monomando-mf-2-project-cuello-alto-81911462/p,Monomando cocina,"El Monomando Project Cuello Alto MF 2 81.9114.62 de Llano de la Torre es el accesorio ideal para tu cocina. Su acabado en cromo le da un toque moderno y elegante. Esta llave monomando para cocina cuenta con un cuello alto para una instalación de Simplo y una llave para fregadero, lo que la hace perfecta para aquellos que buscan un monomando para cocina con estilo. Esta llave monomando para cocina es resistente, duradera y moderna, lo que la hace ideal para la cocina de tu casa. Esta llave monomando para cocina es una excelente opción para aquellos que buscan un diseño moderno y una instalación de Simplo."
Fregadero C-201N Acero Inoxidable,Nuestras Tarjas de la línea Clásica de empotrar son de fácil instalación y se pueden colocar en cualquier tipo de cubierta,https://www.llanodelatorre.com.mx/fregadero-c-201n-acero-inoxidable/p,Fregadero,"El Fregadero C-201N Acero Inoxidable de Llano de la Torre es una tarja de empotrar de fácil instalación que se adapta a cualquier tipo de cubierta. Está fabricado con acero inoxidable de primera calidad para garantizar su durabilidad y resistencia a la corrosión. Su diseño moderno y compacto le da un toque moderno a cualquier cocina. Su instalación es de Simplo, lo que significa que no necesita herramientas especiales para instalarlo. Además, su superficie es fácil de limpiar y mantener, lo que le aporta una gran practicidad. El Fregadero C-201N Acero Inoxidable de Llano de la Torre es una excelente opción para aquellos que buscan una tarja de empotrar de alta calidad y con un diseño moderno."
Monomando Pro MY1 18.1610.02 Cromo,"Maneral extensible, caño giratorio, 2 tipos de chorros, aireador anti calcáreo",https://www.llanodelatorre.com.mx/monomando-pro-my1-18161002-cromo/p,Monomando cocina,"El Monomando Pro MY1 18.1610.02 Cromo de Llano de la Torre es una llave monomando para cocina de última generación que ofrece un maneral extensible, un caño giratorio y dos tipos de chorros. Esta llave para fregadero cuenta con un aireador anti calcáreo para mejorar el flujo de agua y una instalación de Simplo para una fácil instalación. Su diseño moderno y ergonómico ofrece una experiencia única al usuario, permitiendo un control preciso del flujo de agua. El Monomando Pro MY1 18.1610.02 Cromo es una excelente opción para aquellos que buscan una llave monomando para cocina de alta calidad y durabilidad."
Fregadero BE 2C 780 10125051,Fregadero con instalación de submontar de acero inoxidable,https://www.llanodelatorre.com.mx/fregadero-be-2c-780-10125051/p,Fregadero,"El Fregadero BE 2C 780 10125051 de Llano de la Torre es una excelente opción para tu cocina. Está hecho de acero inoxidable de alta calidad para garantizar su durabilidad y resistencia. Su instalación de submontar es fácil y rápida, lo que te permite ahorrar tiempo y esfuerzo. Además, su instalación de Simplo te permite ahorrar espacio en tu cocina. Su diseño moderno y elegante se adapta a cualquier estilo de cocina, desde clásico hasta moderno. El fregadero BE 2C 780 10125051 es una excelente opción para aquellos que buscan una solución de fregadero de calidad superior."
Monomando E-305 Cromo,"Monomando para fregadero Gourmet profesional con resorte, cabezal con sistema anti calcáreo y 2 tipos de chorro",https://www.llanodelatorre.com.mx/monomando-e-305-cromo/p,Monomando cocina,"El Monomando E-305 Cromo de Llano de la Torre es un monomando para fregadero Gourmet profesional con resorte, cabezal con sistema anti calcáreo y 2 tipos de chorro. Es una de las mejores opciones para la instalación de monomandos para cocina, ya que ofrece una llave monomando cocina de alta calidad, con un diseño moderno y elegante. Esta llave para fregadero es perfecta para una instalación de Simplo, ya que su diseño se ajusta perfectamente a la arquitectura moderna. El Monomando E-305 Cromo es una excelente opción para cualquier cocina profesional, dando un toque moderno y elegante al espacio."
Mezcladora 318QC Cromo,"Mezcladora de 8"" para fregadero, con cubierta y manerales",https://www.llanodelatorre.com.mx/mezcladora-318qc-cromo/p,Mezcladora cocina,"La Mezcladora 318QC Cromo de Llano de la Torre es una mezcladora para cocina de 8"" con cubierta y manerales. Esta mezcladora de alta calidad se caracteriza por su llave mezcladora ergonómica, que permite un ajuste suave y preciso. Además, su instalación de Simplo le asegura una instalación sencilla y rápida. Esta mezcladora cuenta con un diseño de vanguardia, que le aporta un toque moderno a tu cocina. La mezcladora 318QC Cromo de Llano de la Torre es un producto de primera calidad, que garantiza una experiencia de uso satisfactoria."
Monomando E-39 Cromo,"Monomando para fregadero Ergo, con cabezal retráctil, sistema anti calcáreo y 2 tipos de chorro",https://www.llanodelatorre.com.mx/monomando-e-39-cromo/p,Monomando cocina,"El Monomando E-39 Cromo de Llano de la Torre es la llave perfecta para tu cocina. Está diseñado para instalarse en un solo paso con el sistema de instalación Simplo, que hace que sea fácil de instalar. Esta llave monomando para cocina cuenta con un cabezal retráctil, un sistema anti calcáreo y dos tipos de chorro. Esto significa que es fácil de limpiar y mantener, y que puedes elegir entre un chorro fuerte o un chorro suave para tu fregadero. Esta llave monomando para cocina es una excelente elección para aquellos que buscan una solución práctica y duradera."
"Triturador GX50C 1/2 HP 2,600 RPM","La calidad, estilo y rendimiento de Moen se demuestran tanto por arriba como por debajo del fregadero",https://www.llanodelatorre.com.mx/triturador-gx50c-12-hp-2600-rpm/p,Otros,[]
Mezcladora MEF-SP-01 Cromo,"Mezcladora para fregadero, con manerales",https://www.llanodelatorre.com.mx/mezcladora-mef-sp-01-cromo/p,Mezcladora cocina,La Mezcladora MEF-SP-01 Cromo de Llano de la Torre es una mezcladora para cocina de alto rendimiento. Esta mezcladora cuenta con una llave mezcladora de última generación para controlar el flujo del agua con facilidad. La instalación de Simplo le permite al usuario instalar la mezcladora con rapidez y facilidad. Esta mezcladora para cocina está hecha con materiales de alta calidad para garantizar una larga durabilidad. Está diseñada con un estilo moderno para mejorar la apariencia de la cocina. El diseño ergonómico de la mezcladora le ofrece al usuario una experiencia de uso cómoda. Esta mezcladora para cocina es una excelente opción para aquellos que buscan una mezcladora de alta calidad a un precio asequible.
Mezcladora 320LB Cromo,"Mezcladora para cocina con cubierta, con manerales Lebarón",https://www.llanodelatorre.com.mx/mezcladora-320lb-cromo/p,Mezcladora cocina,"La Mezcladora 320LB Cromo de Llano de la Torre es una mezcladora para cocina de alta calidad. Está fabricada con materiales resistentes y duraderos, lo que la hace ideal para uso diario. Cuenta con una cubierta de acero cromado y una llave mezcladora para facilitar su uso. La instalación de Simplo es sencilla y segura, lo que la hace ideal para usar en casa. Esta mezcladora es perfecta para mezclar alimentos, preparar sopas, cremas y todo tipo de comidas. Ofrece una excelente calidad de mezcla, lo que la hace ideal para aquellos que buscan una mezcladora de calidad."
Mezcladora HM-38 Cromo,Llave mezcladora para fregadero Flamingos,https://www.llanodelatorre.com.mx/mezcladora-hm-38-cromo/p,Mezcladora cocina,"La Mezcladora HM-38 Cromo de Llano de la Torre es una llave mezcladora de primera calidad para su cocina. Esta mezcladora para cocina es una solución ideal para su instalación de Simplo, ya que ofrece una excelente relación calidad-precio. Esta llave mezcladora cuenta con un diseño moderno y elegante, con un acabado cromado brillante que le aporta un toque moderno a su cocina. Es fácil de instalar y con una válvula de cierre de cerámica para una mayor durabilidad. Esta mezcladora le ofrece un agradable flujo de agua para una experiencia de uso cómoda y sin problemas. Además, la Mezcladora HM-38 Cromo de Llano de la Torre cuenta con una garantía de por vida para su tranquilidad. Si está buscando una mezcladora de calidad para su cocina, la Mezcladora HM-38 Cromo de Llano de la Torre es la mejor opción."
Campana DJE 90 091102 110V Acero Inoxidable,"Diferentes opciones de diseño pensadas para encontrar el equilibrio que buscas en tu cocina, acorde a tu estilo de vida",https://www.llanodelatorre.com.mx/campana-dje-90-091102-inoxidable-110v/p,Campana,"La Campana DJE 90 091102 110V Acero Inoxidable de Llano de la Torre es una campana para cocina ideal para los amantes de la decoración moderna. Esta campana extractora es una opción perfecta para aquellos que buscan un equilibrio entre diseño y funcionalidad. Está fabricada en acero inoxidable de alta calidad, lo que le da una apariencia resistente y duradera. Además, cuenta con una luz LED de alta luminosidad para una iluminación óptima y un filtro de carbón para una mejor limpieza. Esta campana extractora es una excelente opción para aquellos que buscan una campana moderna y funcional para su cocina."
Monomando E-307 Cromo,Monomando curvo con manguera retráctil y sistema anti calcáreo,https://www.llanodelatorre.com.mx/monomando-e-307-cromo/p,Monomando cocina,"El Monomando E-307 Cromo de Llano de la Torre es una de las mejores opciones para los monomandos de la cocina. Viene con una manguera retráctil y un sistema anti-calcáreo, para que puedas disfrutar de una limpieza profunda y una larga duración. Esta llave monomando para la cocina es perfecta para la instalación de Simplo, ya que es fácil de instalar y usar. Esta llave para fregadero es resistente a la corrosión y a la presión del agua, por lo que puedes estar seguro de que disfrutarás de una llave de calidad durante muchos años. El Monomando E-307 Cromo de Llano de la Torre es una excelente opción para aquellos que buscan una llave monomando para la cocina de calidad."
Fregadero M-100 Acero Inoxidable,Nuestras Tarjas de la línea Mark de empotrar son de fácil instalación y se pueden colocar en cualquier tipo de cubierta,https://www.llanodelatorre.com.mx/fregadero-m-100-acero-inoxidable/p,Fregadero,"El Fregadero M-100 Acero Inoxidable de Llano de la Torre es una tarja de empotrar de fácil instalación. Está diseñado para adaptarse a cualquier tipo de cubierta. Su acabado en acero inoxidable aporta un toque moderno y elegante a tu cocina. Instalarlo es una tarea sencilla, gracias a su instalación de Simplo. Su diseño ergonómico te permite aprovechar al máximo el espacio disponible, además de ser fácil de limpiar. Esta tarja es una excelente opción para aquellos que buscan un fregadero duradero y de gran calidad. Su calidad y resistencia lo hacen una excelente inversión para tu cocina."
Monomando 5923 Cromo,"Monomando extraíble para tarja con rociador, acabado en cromo",https://www.llanodelatorre.com.mx/monomando-5923-cromo/p,Monomando cocina,"El Monomando 5923 Cromo de Llano de la Torre es una llave monomando para la cocina ideal para la instalación de Simplo. Esta llave es extraíble para tarja, con un acabado moderno y elegante en cromo. Esta llave monomando para cocina es perfecta para los fregaderos de la cocina, ya que su diseño ergonómico permite una mejor manipulación. Con su innovadora tecnología, el Monomando 5923 Cromo de Llano de la Torre ofrece una mayor comodidad y facilidad de uso. Esta llave monomando para cocina es resistente a la corrosión y a los golpes, por lo que es una opción ideal para aquellos que buscan un producto de calidad y duradero. Si estás buscando una llave monomando para tu cocina, el Monomando 5923 Cromo de Llano de la Torre es la mejor opción."
Parrilla EH 5G AI TR 40225180 70,Esta placa incorpora quemadores de alto rendimiento SABAF para un ahorro energético real de hasta un 25% comparado con las cocinas tradicionales. Cocina tus recetas favoritas ahorrando dinero y cuidando del medio ambiente,https://www.llanodelatorre.com.mx/parrilla-eh-5g-ai-tr-40225180-70/p,Otros,[]
Cespol Doble TV-031 Cromo,Conexión para céspol. Tarja doble,https://www.llanodelatorre.com.mx/cespol-doble-tv-031-cromo/p,Cespol,"El Cespol Doble TV-031 Cromo de Llano de la Torre es una conexión para céspol ideal para la instalación de un sifón en un tubo de lavabo. Está diseñado para encajar perfectamente en un tubo en forma de U, permitiendo una instalación de Simplo y fácil. Esta tarja doble es resistente, estable y duradera, fabricada con materiales de alta calidad y acabado cromado. Ofrece una conexión segura y confiable para una instalación perfecta. Esta tarja doble es una excelente opción para los baños modernos."
Fregadero C-101N Acero Inoxidable,Nuestras Tarjas de la línea Clásica de empotrar son de fácil instalación y se pueden colocar en cualquier tipo de cubierta,https://www.llanodelatorre.com.mx/fregadero-c-101n-acero-inoxidable/p,Fregadero,"El Fregadero C-101N Acero Inoxidable de Llano de la Torre es un producto de alta calidad para tu cocina. Está fabricado con acero inoxidable de primera calidad para garantizar una larga vida útil. Esta tarja de empotrar es fácil de instalar y se adapta a cualquier tipo de cubierta. La instalación es un proceso de Simplo que no requiere de herramientas especializadas, lo que la hace una opción ideal para aquellos con un presupuesto limitado. El diseño moderno del fregadero le da un toque elegante a tu cocina. Esta tarja de empotrar es resistente a la corrosión y a la decoloración, lo que garantiza que se mantenga en excelentes condiciones a pesar del uso constante. El Fregadero C-101N Acero Inoxidable de Llano de la Torre es una excelente opción para aquellos que quieren un fregadero de calidad para su cocina."
Fregadero de Submontar BE 40.40.2 10125019,"Fabricados con material de la mayor durabilidad y sometidos a infinidad de test de resistencia, para alcanzar un producto de calidad inigualable",https://www.llanodelatorre.com.mx/fregadero-be-40402-submontar-10125019/p,Fregadero,"El Fregadero de Submontar BE 40.40.2 10125019 de Llano de la Torre es un producto de calidad excepcional. Está fabricado con materiales de alta resistencia y ha pasado por infinidad de pruebas de resistencia para garantizar su durabilidad. Está diseñado para una instalación de Simplo y cumple con todas las normativas de seguridad para garantizar una perfecta instalación. Ofrece una experiencia de limpieza sin igual, con una profundidad de 40 cm y un ancho de 40 cm, es perfecto para cualquier cocina. Incluye una garantía de 5 años para brindar tranquilidad a los usuarios. Su acabado en color blanco le da una apariencia moderna a cualquier cocina. El Fregadero de Submontar BE 40.40.2 10125019 de Llano de la Torre es la mejor opción para obtener un producto de calidad y durabilidad excepcional."
Mezcladora 4331 Cromo,"Mezcladora de 8"" para fregadero, con cubierta y manerales cruceta",https://www.llanodelatorre.com.mx/mezcladora-4331-cromo/p,Mezcladora cocina,"La Mezcladora 4331 Cromo de Llano de la Torre es una mezcladora para cocina de 8"" con cubierta y manerales cruceta. Esta llave mezcladora incluye una instalación de Simplo que es fácil de usar, y te permite ajustar la temperatura del agua con facilidad. Esta mezcladora para cocina es resistente a la corrosión y viene con una garantía de 5 años. Su diseño moderno y elegante hará que tu cocina luzca increíble. Esta mezcladora de alta calidad es perfecta para tu hogar y te asegurará que tengas agua fría y caliente a la temperatura deseada."
Mezcladora para Cocina 7565BL Negro Mate,"Monomando para cocina con nariz retráctil, acabado ébano",https://www.llanodelatorre.com.mx/mezcladora-7565bl-pcocina-negro-mate/p,Mezcladora cocina,"La Mezcladora para Cocina 7565BL Negro Mate de Llano de la Torre es una llave mezcladora con un acabado ébano que le dará a tu cocina un look moderno. Esta mezcladora cuenta con una nariz retráctil, lo que te permitirá ahorrar espacio en tu cocina. La instalación de esta mezcladora es muy sencilla gracias al sistema de instalación Simplo, y su diseño ergonómico te permitirá usarla con comodidad y facilidad. Esta mezcladora para cocina se ha fabricado con materiales resistentes y de alta calidad, garantizando así su durabilidad y resistencia. Esta mezcladora para cocina es la solución perfecta para aquellos que buscan una mezcladora moderna y de calidad."
"Mezcladora 319 8"" Cromo","Mezcladora para cocina de 8"" de latón, sin manerales",https://www.llanodelatorre.com.mx/mezcladora-319-8-cromo/p,Mezcladora cocina,"La Mezcladora 319 8"" Cromo de Llano de la Torre es una mezcladora para cocina de 8"" de latón, sin manerales. Esta mezcladora es perfecta para la instalación de Simplo, ya que viene con una llave mezcladora para una fácil instalación. Esta mezcladora es resistente y duradera, con un diseño moderno que se verá perfecto en cualquier cocina. Su acabado cromado le da un toque de elegancia a tu cocina. Esta mezcladora es fácil de usar y mantener, lo que la hace ideal para usuarios principiantes o profesionales. Su diseño ergonómico te permite usarla con facilidad y comodidad. Esta mezcladora es una excelente opción para aquellos que buscan una mezcladora de calidad que sea resistente y duradera."
Mezcladora HM-37 Cromo,Llave mezcladora para fregadero Albatros,https://www.llanodelatorre.com.mx/mezcladora-hm-37-cromo/p,Mezcladora cocina,"La Mezcladora HM-37 Cromo de Llano de la Torre es una llave mezcladora para cocina de alta calidad. Está fabricada con materiales de primera calidad para una durabilidad y resistencia excepcionales. Esta mezcladora es fácil de instalar con la instalación de Simplo, lo que la hace perfecta para cualquier cocina. Esta mezcladora es resistente al desgaste y ofrece un control de flujo de agua preciso para una mezcla perfecta. Esta llave mezcladora es una excelente opción para todos los amantes de la cocina que buscan un producto de calidad. La Mezcladora HM-37 Cromo de Llano de la Torre es una excelente opción para todos aquellos que desean una mezcladora para su cocina."
Fregadero C-202N Acero Inoxidable,Nuestras Tarjas de la línea Clásica de empotrar son de fácil instalación y se pueden colocar en cualquier tipo de cubierta,https://www.llanodelatorre.com.mx/fregadero-c-202n-acero-inoxidable/p,Fregadero,"El Fregadero C-202N de Acero Inoxidable de la marca Llano de la Torre es una tarja de empotrar de fácil instalación. Esta tarja es perfecta para cualquier tipo de cubierta. Su instalación de Simplo le permite ahorrar tiempo y esfuerzo, sin comprometer la calidad. El acero inoxidable le ofrece resistencia a la corrosión y durabilidad, mientras que su diseño moderno le da un toque de estilo a tu cocina. Además, su versatilidad te permite usar el fregadero para una variedad de tareas. Esta tarja es la elección perfecta para aquellos que buscan una solución de calidad para su cocina."
[],[],[],Otros,[]
Lavavajillas LP8 850 M 40782510 Acero Inoxidable,Lavavajillas de libre instalación LP8 850 M,https://www.llanodelatorre.com.mx/lavavajillas-lp8-850-m-40782510-inoxidable/p,Otros,[]
Monomando E-34 Cromo,Llave monomando para fregadero Novus,https://www.llanodelatorre.com.mx/monomando-e-34-cromo/p,Monomando cocina,"El Monomando E-34 Cromo de Llano de la Torre es una llave monomando para cocina con un diseño moderno y elegante. Está diseñado para ser instalado fácilmente, sin necesidad de herramientas especiales. Esta llave monomando para fregadero ofrece una instalación de Simplo, para una instalación rápida y sencilla. El Monomando E-34 Cromo es una llave monomando para cocina de calidad, con un acabado cromado para resistencia y durabilidad. Esta llave monomando para fregadero es perfecta para darle a tu cocina un toque moderno y elegante. Es una buena opción para aquellos que buscan una llave monomando para cocina de calidad a un precio asequible."
Fregadero 3 perforaciones 508.533 1C (20.21) 08071132 Acero Inoxidable,"Su elegante diseño en acero inoxidable de primera calidad, brinda un elemento de elegancia",https://www.llanodelatorre.com.mx/fregadero-508533-1c-2021-3-perf-08071132-acero-inoxidable/p,Fregadero,"El Fregadero 3 perforaciones 508.533 1C (20.21) 08071132 Acero Inoxidable de Llano de la Torre es un producto de lujo con un diseño moderno y elegante. Está hecho de acero inoxidable de primera calidad para una resistencia y durabilidad excepcionales. Viene con tres perforaciones para una instalación de Simplo, lo que le permite aprovechar el espacio al máximo. Está diseñado para resistir el uso diario, y su acabado en acero inoxidable le da un aspecto moderno y sofisticado. Además, es fácil de limpiar para mantenerlo brillante y sin manchas. El Fregadero 3 perforaciones 508.533 1C (20.21) 08071132 Acero Inoxidable de Llano de la Torre es la opción perfecta para quienes buscan un fregadero de lujo con una instalación de Simplo."
