Producto,Descripcion,Link,Categoria,Response
Monomando Edgewater 4932300MX.002 Cromo,Monomando para cocina Edgewater en cromo,https://www.llanodelatorre.com.mx/4932300mx002-monomando-edgewater-cromo/p,Monomando cocina,"El Monomando Edgewater 4932300MX.002 Cromo de Llano de la Torre es la mejor opción para aquellos que desean un monomando para cocina de alta calidad. Esta llave monomando cocina es perfecta para su instalación de Simplo, ya que es resistente, duradera y moderna. El diseño cromado es ideal para una cocina moderna, y la llave para fregadero es ergonómica y cómoda para usar. Esta llave monomando para cocina ofrece una mezcla perfecta de estilo y funcionalidad, y es una excelente opción para aquellos que desean una llave monomando para cocina de calidad."
Fregadero C-300 Acero Inoxidable,Nuestras Tarjas de la línea Clásica de empotrar son de fácil instalación y se pueden colocar en cualquier tipo de cubierta,https://www.llanodelatorre.com.mx/fregadero-c-300-acero-inoxidable/p,Fregadero,"El Fregadero C-300 Acero Inoxidable de la marca Llano de la Torre es una tarja de empotrar de fácil instalación. Está hecho de acero inoxidable de alta calidad para garantizar una mayor durabilidad y resistencia. Viene con un diseño moderno y elegante que se adapta perfectamente a cualquier tipo de cubierta. La instalación de Simplo de esta tarja de empotrar permite una instalación rápida y sencilla sin necesidad de herramientas especiales. Esta tarja de empotrar también cuenta con un sistema de drenaje inteligente que ayuda a prevenir el desbordamiento de agua. Está diseñado para resistir el desgaste y la corrosión, por lo que es ideal para un uso diario. El Fregadero C-300 Acero Inoxidable de la marca Llano de la Torre es una excelente opción para cualquier cocina."
Mezcladora para Cocina 9329 Cromo,"Mezcladora 8"" para fregadero con cubierta y manerales de palanca",https://www.llanodelatorre.com.mx/mezcladora-9329-para-cocina-cromo/p,Mezcladora cocina,"La Mezcladora para Cocina 9329 Cromo de Llano de la Torre es una mezcladora 8"" para fregadero con cubierta y manerales de palanca. Esta mezcladora es fácil de instalar y cuenta con una llave mezcladora para un control preciso del flujo de agua. Esta mezcladora está diseñada para una instalación de Simplo, lo que significa que es una opción ideal para proyectos de remodelación. Esta mezcladora es resistente al desgaste y a la corrosión, y cuenta con una garantía limitada de por vida para garantizar su satisfacción. Esta mezcladora es una excelente opción para todos los proyectos de cocina, ya que ofrece un estilo moderno, una alta calidad y un rendimiento superior."
Monomando para Cocina S72308 Cromo,"Equipado con el sistema Réflex para un funcionamiento suave, facilidad de movimiento",https://www.llanodelatorre.com.mx/monomando-s72308-pcocina-cromo/p,Monomando cocina,"El Monomando para Cocina S72308 Cromo de Llano de la Torre es la mejor solución para tu cocina. Está equipado con el sistema Réflex para un funcionamiento suave y facilidad de movimiento. Esta llave monomando para cocina viene con una instalación de Simplo, lo que hace que sea sencillo de instalar. Además, es perfecto para fregaderos, gracias a su diseño ergonómico y moderno. Esta llave monomando para cocina es resistente, duradera y fácil de usar. Está diseñado con materiales de primera calidad para una mejor resistencia y durabilidad. Disfruta de la comodidad y la facilidad de uso que ofrece el Monomando para Cocina S72308 Cromo de Llano de la Torre."
[],[],[],Otros,[]
Monomando para Cocina 9438 Cromo,Monomando para cocina con nariz retráctil,https://www.llanodelatorre.com.mx/monomando-9438-pcocina-cromo/p,Monomando cocina,"El Monomando para Cocina 9438 Cromo de Llano de la Torre es una llave monomando con nariz retráctil que ofrece una solución perfecta para su instalación de Simplo. Esta llave monomando para cocina viene con una estética moderna y un diseño ergonómico, para un uso cómodo y fácil. Esta llave monomando para fregadero es fácil de instalar y de usar, y es ideal para todos los tipos de cocina. Esta llave monomando para cocina ofrece una resistencia duradera y una excelente calidad de materiales. Esta llave monomando para cocina 9438 Cromo de Llano de la Torre es perfecta para aquellos que buscan una solución moderna, eficiente y de calidad."
Monomando para Cocina Quince 4433300MX.002 Cromo,Monomando para cocina con acabado en cromo,https://www.llanodelatorre.com.mx/4433300mx002-monomando-pcocina-quince-cromo/p,Monomando cocina,"El Monomando para Cocina Quince 4433300MX.002 Cromo de Llano de la Torre es una excelente opción para aquellos que buscan una llave monomando para su cocina. Esta llave monomando para fregadero es perfecta para aquellos que quieren una instalación de Simplo. Está fabricado con materiales de alta calidad y su acabado en cromo le da un toque moderno y elegante a su cocina. Esta llave monomando es resistente a la corrosión y a los daños causados por el uso diario, lo que le garantiza una durabilidad óptima. Es fácil de instalar y de usar, y su diseño se adapta a cualquier tipo de cocina. Esta llave monomando para cocina es una excelente opción para aquellos que buscan un producto de calidad."
Mezcladora ME-303 Premier Cromo,"Mezcladora para fregadero Premier, con cabezal retráctil, magnético, sistema anti calcáreo y dos tipos de chorro",https://www.llanodelatorre.com.mx/mezcladora-me-303-premier-cromo/p,Mezcladora cocina,"La Mezcladora ME-303 Premier Cromo de Llano de la Torre es una mezcladora para cocina con un diseño único y moderno. Esta mezcladora cuenta con un cabezal retráctil, magnético y un sistema anti calcáreo para garantizar una limpieza perfecta. Además, la Mezcladora ME-303 Premier Cromo cuenta con dos tipos de chorro para una mayor comodidad. La llave mezcladora está diseñada para facilitar la instalación de Simplo. Esta mezcladora es perfecta para cualquier cocina moderna, ya que ofrece un estilo único y una calidad superior."
Mezcladora 320 Cromo,"Mezcladora para fregadero con cubierta de cuello de ganso 8""",https://www.llanodelatorre.com.mx/mezcladora-320-cromo/p,Mezcladora cocina,"La Mezcladora 320 Cromo de la marca Llano de la Torre es una mezcladora para cocina de excelente calidad. Esta mezcladora cuenta con una cubierta de cuello de ganso de 8 pulgadas, la cual ofrece un diseño moderno y elegante para tu cocina. Esta mezcladora para fregadero es perfecta para la instalación de Simplo, ya que cuenta con una llave mezcladora de alta calidad y resistencia. El diseño de la mezcladora es ergonómico y cómodo, lo que te permite usarla con facilidad. Esta mezcladora es resistente a la corrosión y a la suciedad, ofreciendo una durabilidad y una limpieza de larga duración. Esta mezcladora es una excelente opción para tu cocina, ya que ofrece una calidad superior a un precio asequible."
Fregadero 2 perforaciones 381.381 1C 08821022 1C,Fregadero de acero inoxidable para empotre,https://www.llanodelatorre.com.mx/fregadero-381381-1c-08821022-1c-2perf/p,Fregadero,"Este fregadero de acero inoxidable de Llano de la Torre es perfecto para la instalación de Simplo. Su diseño de 2 perforaciones con el número de modelo 381.381 1C 08821022 1C, le ofrece una solución práctica y moderna para su baño. El acabado del fregadero le da un toque de elegancia a cualquier espacio, mientras que sus características de resistencia y durabilidad hacen que sea una excelente opción. Está construido con materiales de primera calidad para garantizar una larga vida útil. El fregadero es fácil de limpiar y mantener, lo que lo hace ideal para uso diario. Puede instalarse fácilmente para una funcionalidad óptima. Esta es una excelente opción para aquellos que buscan un fregadero de calidad."
Fregadero C-212N Acero Inoxidable,Nuestras Tarjas de la línea Clásica de empotrar son de fácil instalación y se pueden colocar en cualquier tipo de cubierta,https://www.llanodelatorre.com.mx/fregadero-c-212n-acero-inoxidable/p,Fregadero,"El Fregadero C-212N Acero Inoxidable de Llano de la Torre es una tarja de empotrar de fácil instalación. Está fabricado con acero inoxidable de alta calidad para garantizar una durabilidad y resistencia excepcional, además de un diseño moderno y elegante que se adapta a cualquier tipo de cubierta. Su instalación de Simplo permite una colocación sencilla y rápida, lo que hace que sea una gran opción para cualquier proyecto de remodelación. Sus bordes pulidos y su acabado satinado le otorgan un toque de sofisticación a tu cocina, lo que lo convierte en el complemento perfecto a cualquier decoración. Esta tarja de empotrar es una excelente opción para aquellos que desean un fregadero de calidad, resistente y con un diseño moderno."
Monomando VTK 938 24.938.02.10 Cromo,Grifo de cocina monomando con caño alto extraíble y aireador extraíble,https://www.llanodelatorre.com.mx/monomando-vtk-938-249380210-cromo/p,Monomando cocina,El Monomando VTK 938 24.938.02.10 Cromo de Llano de la Torre es una de las mejores opciones en monomandos para cocina. Esta llave monomando cocina ofrece un caño alto extraíble y un aireador extraíble. Esto hace que sea una excelente opción para la instalación de Simplo. Esta llave para fregadero es perfecta para los que buscan un producto de calidad y con un diseño moderno. Su acabado en cromo hace que sea una opción elegante para su cocina. Esta llave monomando cocina es la mejor opción para aquellos que buscan un producto duradero y de calidad.
Llave VCG-2 Cromo,Llave de hospital con cuello de ganso giratorio manija corta,https://www.llanodelatorre.com.mx/llave-vcg-2-cromo/p,Otros,[]
Monomando para Cocina 7081 Cromo,Llave de cocina monomando extraíble con acabado en cromo,https://www.llanodelatorre.com.mx/monomando-7081-pcocina-cromo/p,Monomando cocina,"El Monomando para Cocina 7081 Cromo de Llano de la Torre es una llave monomando extraíble con un acabado en cromo para tus necesidades de cocina. Esta llave de cocina es perfecta para instalar en tu fregadero con rapidez y facilidad. El Monomando para Cocina 7081 Cromo es una opción ideal para la instalación de Simplo. Su diseño ergonómico y sus materiales de calidad garantizan una durabilidad y resistencia excepcionales. Esta llave monomando cocina ofrece una experiencia de usuario óptima, con una resistencia a la corrosión y una facilidad de uso increíble. Además, su acabado en cromo le da un toque moderno y elegante a tu cocina. El Monomando para Cocina 7081 Cromo de Llano de la Torre es la mejor opción para tus necesidades de cocina."
Campana de Empotrar C 8310 40467420 Acero Inoxidable,Campanas de empotre,https://www.llanodelatorre.com.mx/campana-c-8310-40467420-pempotrar-a-inox/p,Campana,"La Campana de Empotrar C 8310 40467420 Acero Inoxidable de Llano de la Torre es una excelente opción para su cocina. Esta campana para cocina es perfecta para los amantes de la cocina moderna, con su diseño minimalista y su acabado en acero inoxidable. Esta campana extractora es ideal para eliminar el humo y los olores que se generan al cocinar. Esta campana extractora está diseñada para ser empotrada en la pared, con una capacidad de extracción de hasta 800 m3/h, lo que la convierte en una de las mejores opciones para su cocina. Esta campana extractora también cuenta con una luz LED para iluminar su cocina, y un filtro de grasa para mantener el aire limpio. Esta campana de empotrar es una excelente opción para su cocina."
Fregadero C-211N Acero Inoxidable,Nuestras Tarjas de la línea Clásica de empotrar son de fácil instalación y se pueden colocar en cualquier tipo de cubierta,https://www.llanodelatorre.com.mx/fregadero-c-211n-acero-inoxidable/p,Fregadero,"El Fregadero C-211N de Acero Inoxidable de Llano de la Torre es una tarja de fácil instalación que puede ser colocada en cualquier tipo de cubierta. Esta tarja cuenta con un diseño moderno y elegante que se adaptará a cualquier estilo de cocina. Su instalación es de Simplo, ya que no requiere de herramientas ni de conocimientos técnicos, lo que la hace ideal para aquellos que quieren una instalación rápida y sencilla. El acero inoxidable de la que está hecho el fregadero es resistente a la corrosión y a la decoloración, y su superficie es fácil de limpiar. Esta tarja ofrece una durabilidad y una resistencia a la vez que una apariencia moderna, haciéndola perfecta para aquellos que buscan una tarja de calidad a un precio asequible."
Monomando 4086 Cromo,Monomando ecológico para fregadero,https://www.llanodelatorre.com.mx/5-306-monomando-4086-cromo/p,Monomando cocina,"El Monomando 4086 Cromo de Llano de la Torre es una solución perfecta para la instalación de tu cocina. Esta llave monomando es ideal para el fregadero y ofrece una instalación de Simplo para una mejor experiencia. Esta llave monomando para cocina es una opción económica que ofrece una durabilidad y resistencia excepcional. El Monomando 4086 Cromo es un monomando para cocina que ofrece una facilidad de uso superior y una apariencia moderna. El diseño de la llave monomando para fregadero es ergonómico y resistente a la corrosión, lo que la hace perfecta para uso diario. Esta llave monomando para cocina es una excelente opción para la instalación de tu cocina y ofrece una excelente relación calidad-precio."
Monomando para Cocina 7594BL Negro Mate,Monomando para cocina con acabado mate en color negro,https://www.llanodelatorre.com.mx/monomando-7594bl-pcocina-negro-mate/p,Monomando cocina,El Monomando para Cocina 7594BL Negro Mate de Llano de la Torre es una llave monomando para la cocina que ofrece una instalación de Simplo. Esta llave monomando para cocina está fabricada con un acabado mate en color negro. Esta llave para fregadero es fácil de instalar y es perfecta para aquellos que buscan una solución práctica y moderna para su cocina. Está diseñada con materiales resistentes para garantizar un uso prolongado. Esta llave monomando para cocina es una excelente opción para aquellos que buscan un producto de calidad y duradero para su cocina.
Cespol TV-030 Cromo,Céspol para fregadero con registro,https://www.llanodelatorre.com.mx/cespol-tv-030-cromo/p,Cespol,"Cespol TV-030 Cromo de Llano de la Torre es una excelente opción para la instalación de su fregadero. El céspol incluye un sifón para una perfecta evacuación del agua. El tubo de lavabo es de forma en U, lo que facilita la instalación de Simplo. Además, el céspol está fabricado con materiales de primera calidad y con un acabado cromado que le otorga una apariencia moderna y elegante, que seguramente se destacará en cualquier cocina. El céspol es fácil de instalar y mantener, lo que lo hace ideal para una amplia variedad de fregaderos. Esta es una gran opción para cualquier hogar que busque una solución de alto rendimiento para su instalación de fregadero."
Mezcladora 4317 Cromo,"Mezcladora ecológico de 8"" para fregadero de cuello corto",https://www.llanodelatorre.com.mx/mezcladora-4317-cromo/p,Mezcladora cocina,"La Mezcladora 4317 Cromo de Llano de la Torre es una mezcladora para cocina de 8"" con un diseño moderno y elegante. Esta mezcladora cuenta con una llave mezcladora que facilita el control del flujo de agua, y una instalación de Simplo que permite una instalación rápida y sencilla. Esta mezcladora ecológica para fregadero de cuello corto cuenta con una construcción de metal de alta calidad, con un acabado cromado que la hace resistente a la corrosión. Esta mezcladora ofrece una excelente experiencia de uso, con una llave mezcladora ergonómica que facilita la manipulación. Además, la instalación de Simplo permite una instalación sencilla sin la necesidad de herramientas especiales. La Mezcladora 4317 Cromo de Llano de la Torre es el complemento perfecto para tu cocina."
Fregadero BE de Submontar C/Contra 42.40.16 10103100,"Fregadero de submontar, fabricado con acero inoxidable",https://www.llanodelatorre.com.mx/fregadero-be-psub-424016-10103100-c-contra/p,Fregadero,"El Fregadero BE de Submontar C/Contra 42.40.16 10103100 de Llano de la Torre es un fregadero de acero inoxidable de alta calidad y diseño moderno. Su instalación de Simplo es sencilla y segura, con una gran resistencia a la corrosión y al desgaste. Esta versatilidad lo hace ideal para cualquier cocina, ya que se adapta a los requerimientos de cualquier espacio. El diseño de la superficie es liso y fácil de limpiar, con una capacidad de 42.40.16 litros para almacenar agua y alimentos. Está equipado con una válvula de cierre para controlar el flujo de agua, así como con una boquilla de alta presión para una limpieza profunda. El Fregadero BE de Submontar C/Contra 42.40.16 10103100 es una excelente opción para cualquier cocina moderna."
"Mezcladora Ecológica 8"" 4318TS Cromo","Mezcladora Ecológica de 8"" para fregadero de ABS",https://www.llanodelatorre.com.mx/5-302-mezcladora-ecolgica-8-4318ts-cromo/p,Mezcladora cocina,"La Mezcladora Ecológica 8"" 4318TS Cromo de Llano de la Torre es una mezcladora para cocina de alta calidad. Esta mezcladora incluye una llave mezcladora para un control preciso de la temperatura del agua. La instalación de Simplo hace que la instalación sea fácil y segura. Esta mezcladora para cocina es duradera y resistente, con un acabado cromado que le da un toque moderno a cualquier cocina. Tiene un diseño ergonómico para un manejo cómodo y una excelente resistencia a la corrosión. Esta mezcladora es una excelente opción para los que buscan una mezcladora de alta calidad a un precio asequible."
Mezcladora 318LB Cromo,"Mezcladora para cocina de 8"" con manerales",https://www.llanodelatorre.com.mx/mezcladora-318lb-cromo/p,Mezcladora cocina,"La Mezcladora 318LB Cromo de Llano de la Torre es una mezcladora para cocina de 8"" con manerales, diseñada para ofrecer una instalación sencilla y una operación suave. Esta mezcladora cuenta con una llave mezcladora de metal para una facil instalación de Simplo. Esta mezcladora es resistente, duradera y de fácil limpieza. El diseño de la mezcladora es moderno y elegante, además de contar con una válvula de cierre para una operación segura y confiable. Esta mezcladora es ideal para una cocina moderna, y está disponible en acabado cromado para un toque de elegancia. La mezcladora 318LB Cromo de Llano de la Torre es una excelente opción para cualquier cocina."
Fregadero C-100 Acero Inoxidable,Fregadero para cocina C-100,https://www.llanodelatorre.com.mx/fregadero-c-100-acero-inoxidable/p,Fregadero,"El Fregadero C-100 de Acero Inoxidable de Llano de la Torre es una opción ideal para tu cocina. Su instalación es de Simplo, lo que significa que es fácil de instalar. Su acabado en acero inoxidable es resistente a la corrosión y a los arañazos, lo que lo hace ideal para una cocina moderna. El fregadero C-100 es un diseño de una sola cubeta, lo que te permite tener una mayor capacidad para lavar tus platos. Además, el diseño incluye un desagüe de 3,5 pulgadas, que te permite drenar el agua con facilidad. El fregadero C-100 también incluye una válvula de cierre de agua, que te permite ahorrar agua y electricidad. Está construido con materiales de alta calidad, lo que lo hace duradero y resistente al desgaste. El fregadero C-100 de Llano de la Torre es la solución perfecta para tu cocina."
Fregadero Mark M-202,Nuestras Tarjas de la línea Mark de empotrar son de fácil instalación y se pueden colocar en cualquier tipo de cubierta,https://www.llanodelatorre.com.mx/fregadero-m-202-mark/p,Fregadero,"El Fregadero Mark M-202 de Llano de la Torre es la mejor opción para aquellos que buscan una tarja de empotrar de fácil instalación. Esta tarja de empotrar se puede colocar en cualquier tipo de cubierta, lo que la hace perfecta para la instalación en cualquier hogar. Esta tarja de empotrar está diseñada con la instalación de Simplo en mente, lo que significa que es fácil de instalar y no requiere ningún tipo de herramienta especializada. Esta tarja de empotrar también cuenta con un diseño moderno y elegante, que seguramente se destacará en su cocina. Además, viene con una garantía de por vida, para que pueda disfrutar de su fregadero Mark M-202 durante muchos años."
Fregadero M-101 Acero Inoxidable,Nuestras Tarjas de la línea Mark de empotrar son de fácil instalación y se pueden colocar en cualquier tipo de cubierta,https://www.llanodelatorre.com.mx/fregadero-m-101-acero-inoxidable/p,Fregadero,"El Fregadero M-101 Acero Inoxidable de Llano de la Torre es la opción perfecta para aquellos que buscan una tarja de empotrar de fácil instalación. Esta tarja moderna es construida con acero inoxidable de alta calidad para resistencia y durabilidad. La instalación es un proceso de Simplo, que permite una colocación rápida y sin complicaciones en cualquier tipo de cubierta. El diseño moderno de este fregadero le dará a su cocina un toque de elegancia y estilo. El acero inoxidable resistente también le proporcionará una limpieza eficaz para mantener su cocina libre de suciedad. El Fregadero M-101 Acero Inoxidable de Llano de la Torre es la opción perfecta para aquellos que buscan una tarja de empotrar con estilo y durabilidad."
Fregadero BE 2C 880 10125042,Tu fregadero se convertirá en toda una obra de arte. Elegancia y funcionalidad marcan la diferencia,https://www.llanodelatorre.com.mx/fregadero-be-2c-880-10125042/p,Fregadero,"El Fregadero BE 2C 880 10125042 de la marca Llano de la Torre es el elemento perfecto para tu cocina. Está fabricado con materiales resistentes y duraderos para asegurar una larga vida útil. Cuenta con un diseño moderno y elegante que combina perfectamente con la decoración de tu cocina. Su instalación de Simplo es fácil y rápida, lo que te ahorrará tiempo y dinero. El Fregadero BE 2C 880 10125042 es una excelente opción para aquellos que buscan una solución práctica y funcional. Su acabado resistente al desgaste le otorga una belleza única, que se destaca en cualquier espacio. Está equipado con una amplia gama de características para satisfacer todas tus necesidades. El Fregadero BE 2C 880 10125042 de Llano de la Torre es una excelente adición a tu cocina."
Mezcladora Spring Aling 5923BL Negro Mate,Monomando alto para tarja con acabado mate color negro,https://www.llanodelatorre.com.mx/mezcladora-5923bl-spring-align-negro-mate/p,Mezcladora cocina,"La mezcladora para cocina Spring Aling 5923BL Negro Mate de Llano de la Torre es una llave mezcladora monomando alto para tarja con acabado mate color negro. Esta mezcladora es perfecta para cualquier instalación de Simplo, ya que su diseño es moderno y elegante. Esta mezcladora está fabricada con materiales de alta calidad, lo que garantiza una larga durabilidad y resistencia a la corrosión. El caño de la mezcladora es flexible y cómodo para usar. La mezcladora Spring Aling 5923BL Negro Mate es una excelente opción para aquellos que buscan una mezcladora de alta calidad y resistente."
Contracanasta PH-301,Contra canasta de fácil instalación para fregadero,https://www.llanodelatorre.com.mx/contracanasta-ph-301/p,Contra,"La Contracanasta PH-301 de Llano de la Torre es un tapón para regadera de fácil instalación. Esta canasta está diseñada con una tecnología contra push que permite un montaje simple y seguro. La instalación de Simplo es una característica única que ofrece facilidad de uso y una instalación rápida. Esta contra canasta es resistente al desgaste y a la corrosión, lo que la hace ideal para uso en el hogar. El diseño ergonómico y moderno le da a esta canasta un toque elegante. La Contracanasta PH-301 es una excelente opción para una instalación duradera y segura."
Fregadero Mark M-201,Nuestras Tarjas de la línea Mark de empotrar son de fácil instalación y se pueden colocar en cualquier tipo de cubierta,https://www.llanodelatorre.com.mx/fregadero-m-201-mark/p,Fregadero,El Fregadero Mark M-201 de Llano de la Torre es un producto de calidad superior que ofrece una instalación de Simplo para una fácil instalación. Esta tarja de empotrar es perfecta para cualquier tipo de cubierta. El Fregadero Mark M-201 está hecho de materiales duraderos para una mayor resistencia y una larga vida útil. Esta tarja de empotrar ofrece un diseño moderno y elegante con un acabado cromado brillante. Esta tarja de empotrar está equipada con un sifón de alta calidad para una mejor limpieza y un flujo de agua más rápido. El Fregadero Mark M-201 es una excelente opción para aquellos que buscan un fregadero duradero y con una instalación de Simplo.
Monomando para Cocina 9434 Cromo,Monomando para cocina con tecnología Limpia Fácil,https://www.llanodelatorre.com.mx/monomando-9434-pcocina-cromo/p,Monomando cocina,"El Monomando para Cocina 9434 Cromo de Llano de la Torre es una llave monomando para cocina moderna y elegante. Esta llave monomando está diseñada para añadir un toque de estilo a su cocina. Viene con un sistema de instalación de Simplo que le permite instalarla rápidamente y sin complicaciones. Esta llave monomando para cocina es ideal para usar con fregaderos, ya que es resistente a la corrosión y a los arañazos, lo que la hace duradera. Además, esta llave monomando para cocina cuenta con una tecnología Limpia Fácil para facilitar la limpieza y mantenimiento de la misma. Esta llave monomando para cocina de Llano de la Torre es una excelente opción para aquellos que buscan una solución moderna y elegante para su cocina."
